{
  "schema": "evolvehls.agentic.profile-registry",
  "schema_version": "1.0",
  "registry_id": "portable-fixture-registry",
  "version": "1.0",
  "adapters": [
    {"schema": "evolvehls.agentic.client-adapter", "schema_version": "1.0", "adapter_id": "generic-http", "invocation_class": "http-api-client", "execution_family": "http", "access_classes": ["api-gateway", "local-server"], "protocols": ["openai-responses", "openai-chat-completions"]},
    {"schema": "evolvehls.agentic.client-adapter", "schema_version": "1.0", "adapter_id": "codex-like", "invocation_class": "native-account-cli", "execution_family": "codex-family", "access_classes": ["native-account-client"], "protocols": ["openai-responses"]},
    {"schema": "evolvehls.agentic.client-adapter", "schema_version": "1.0", "adapter_id": "claude-like", "invocation_class": "native-account-cli", "execution_family": "claude-family", "access_classes": ["native-account-client"], "protocols": ["anthropic-messages"]},
    {"schema": "evolvehls.agentic.client-adapter", "schema_version": "1.0", "adapter_id": "native-local", "invocation_class": "native-local-cli", "execution_family": "local-native", "access_classes": ["native-local-client"], "protocols": ["openai-chat-completions"]}
  ],
  "profiles": [
    {"profile_id": "local-server", "schema_version": "1.0", "adapter_id": "generic-http", "access_class": "local-server", "funding_class": "local", "auth_mode": "none", "binding": {"kind": "local-runtime", "ref": "fixture-runtime"}, "model": {"kind": "selector", "ref": "fixture-local-selector"}, "protocol": "openai-chat-completions", "capabilities": {"basic_text": {"status": "supported", "confidence": "observed", "provenance": ["fixture"]}, "tool_calling": {"status": "supported", "confidence": "observed", "provenance": ["fixture"]}}, "privacy": {"data_classes": ["public", "internal", "restricted"]}, "cost": {"tier": 0}, "resources": {"requires": ["local-runtime"]}, "availability": {"required": true}, "priority": 0},
    {"profile_id": "project-gateway", "schema_version": "1.0", "adapter_id": "generic-http", "access_class": "api-gateway", "funding_class": "project", "auth_mode": "environment-token", "binding": {"kind": "provider-profile", "ref": "fixture-project-binding"}, "model": {"kind": "selector", "ref": "fixture-project-selector"}, "protocol": "openai-responses", "capabilities": {"basic_text": {"status": "supported", "confidence": "observed", "provenance": ["fixture"]}, "tool_calling": {"status": "supported", "confidence": "observed", "provenance": ["fixture"]}}, "privacy": {"data_classes": ["public", "internal"]}, "cost": {"tier": 1}, "resources": {"requires": []}, "availability": {"required": true}, "priority": 1},
    {"profile_id": "organization-api", "schema_version": "1.0", "adapter_id": "generic-http", "access_class": "api-gateway", "funding_class": "organization", "auth_mode": "token-helper", "binding": {"kind": "provider-profile", "ref": "fixture-organization-binding"}, "model": {"kind": "pinned", "ref": "fixture-organization-pin"}, "protocol": "openai-responses", "capabilities": {"basic_text": {"status": "supported", "confidence": "observed", "provenance": ["fixture"]}, "tool_calling": {"status": "supported", "confidence": "observed", "provenance": ["fixture"]}}, "privacy": {"data_classes": ["public"]}, "cost": {"tier": 2}, "resources": {"requires": []}, "availability": {"required": true}, "priority": 2},
    {"profile_id": "codex-session", "schema_version": "1.0", "adapter_id": "codex-like", "access_class": "native-account-client", "funding_class": "subscription", "auth_mode": "native-session", "binding": {"kind": "native-session", "ref": "fixture-codex-session"}, "model": {"kind": "selector", "ref": "fixture-codex-selector"}, "protocol": "openai-responses", "capabilities": {"basic_text": {"status": "supported", "confidence": "observed", "provenance": ["fixture"]}, "tool_calling": {"status": "supported", "confidence": "observed", "provenance": ["fixture"]}}, "privacy": {"data_classes": ["public"]}, "cost": {"tier": 1}, "resources": {"requires": []}, "availability": {"required": true}, "priority": 3},
    {"profile_id": "claude-session", "schema_version": "1.0", "adapter_id": "claude-like", "access_class": "native-account-client", "funding_class": "subscription", "auth_mode": "native-session", "binding": {"kind": "native-session", "ref": "fixture-claude-session"}, "model": {"kind": "selector", "ref": "fixture-claude-selector"}, "protocol": "anthropic-messages", "capabilities": {"basic_text": {"status": "supported", "confidence": "observed", "provenance": ["fixture"]}, "tool_calling": {"status": "supported", "confidence": "observed", "provenance": ["fixture"]}}, "privacy": {"data_classes": ["public"]}, "cost": {"tier": 1}, "resources": {"requires": []}, "availability": {"required": true}, "priority": 4},
    {"profile_id": "personal-api", "schema_version": "1.0", "adapter_id": "generic-http", "access_class": "api-gateway", "funding_class": "personal-api", "auth_mode": "environment-token", "binding": {"kind": "provider-profile", "ref": "fixture-personal-binding"}, "model": {"kind": "selector", "ref": "fixture-personal-selector"}, "protocol": "openai-responses", "capabilities": {"basic_text": {"status": "supported", "confidence": "observed", "provenance": ["fixture"]}, "tool_calling": {"status": "supported", "confidence": "observed", "provenance": ["fixture"]}}, "privacy": {"data_classes": ["public"]}, "cost": {"tier": 1}, "resources": {"requires": []}, "availability": {"required": true}, "priority": 5},
    {"profile_id": "native-local", "schema_version": "1.0", "adapter_id": "native-local", "access_class": "native-local-client", "funding_class": "local", "auth_mode": "none", "binding": {"kind": "local-runtime", "ref": "fixture-native-runtime"}, "model": {"kind": "pinned", "ref": "fixture-native-pin"}, "protocol": "openai-chat-completions", "capabilities": {"basic_text": {"status": "supported", "confidence": "observed", "provenance": ["fixture"]}, "tool_calling": {"status": "supported", "confidence": "observed", "provenance": ["fixture"]}}, "privacy": {"data_classes": ["public", "internal"]}, "cost": {"tier": 0}, "resources": {"requires": ["local-runtime"]}, "availability": {"required": true}, "priority": 1}
  ]
}